{"$schema":"https://json-schema.org/draft/2020-12/schema","$id":"https://policygraph.dev/schemas/1.0/graph.schema.json","type":"object","required":["schema_version","generator_version","fixture_set_sha256","sources","documents","claims","entities","events","relationships"],"additionalProperties":false,"properties":{"schema_version":{"const":"1.0"},"generator_version":{"type":"string","pattern":"^policygraph-[0-9]+\\.[0-9]+\\.[0-9]+$"},"fixture_set_sha256":{"type":"string","pattern":"^[a-f0-9]{64}$"},"sources":{"type":"array","items":{"$ref":"#/$defs/source"}},"documents":{"type":"array","items":{"$ref":"#/$defs/document"}},"claims":{"type":"array","items":{"$ref":"#/$defs/claim"}},"entities":{"type":"array","items":{"$ref":"#/$defs/entity"}},"events":{"type":"array","items":{"$ref":"#/$defs/event"}},"relationships":{"type":"array","items":{"$ref":"#/$defs/relationship"}}},"$defs":{"source":{"type":"object","required":["id","title","publisher","url","kind","topics","status","status_as_of"],"additionalProperties":false,"properties":{"id":{"type":"string","pattern":"^[a-z0-9][a-z0-9-]{0,99}$"},"title":{"type":"string","minLength":1},"publisher":{"type":"string","minLength":1},"url":{"type":"string","format":"uri"},"kind":{"enum":["govuk_content","web_page"]},"topics":{"type":"array","items":{"type":"string","minLength":1},"uniqueItems":true},"status":{"enum":["consultation","proposal","final_rule","in_force"]},"status_as_of":{"type":"string","format":"date"},"published_on":{"type":["string","null"],"format":"date"},"content_path":{"type":["string","null"],"minLength":1}}},"document":{"type":"object","required":["id","source_id","title","text","retrieved_from","synthetic"],"additionalProperties":false,"properties":{"id":{"type":"string","minLength":1},"source_id":{"type":"string","minLength":1},"title":{"type":"string","minLength":1},"text":{"type":"string"},"retrieved_from":{"type":"string","format":"uri"},"published_on":{"type":["string","null"],"format":"date"},"synthetic":{"type":"boolean"}}},"evidence":{"type":"object","required":["document_id","section","quote"],"additionalProperties":false,"properties":{"document_id":{"type":"string","minLength":1},"section":{"type":"string","pattern":"^line:[1-9][0-9]*$"},"quote":{"type":"string","minLength":1}}},"claim":{"type":"object","required":["id","source_id","subject","predicate","object","status","status_as_of","evidence","topics"],"additionalProperties":false,"properties":{"id":{"type":"string","minLength":1},"source_id":{"type":"string","minLength":1},"subject":{"type":"string","minLength":1},"predicate":{"type":"string","minLength":1},"object":{"type":"string","minLength":1},"status":{"enum":["consultation","proposal","final_rule","in_force"]},"status_as_of":{"type":"string","format":"date"},"evidence":{"$ref":"#/$defs/evidence"},"topics":{"type":"array","items":{"type":"string","minLength":1},"uniqueItems":true}}},"entity":{"type":"object","required":["id","name","kind","aliases"],"additionalProperties":false,"properties":{"id":{"type":"string","minLength":1},"name":{"type":"string","minLength":1},"kind":{"enum":["organisation","policy","topic"]},"aliases":{"type":"array","items":{"type":"string","minLength":1},"uniqueItems":true}}},"event":{"type":"object","required":["id","title","date","status","status_as_of","source_id","evidence","topics"],"additionalProperties":false,"properties":{"id":{"type":"string","minLength":1},"title":{"type":"string","minLength":1},"date":{"type":["string","null"],"format":"date"},"status":{"enum":["consultation","proposal","final_rule","in_force"]},"status_as_of":{"type":"string","format":"date"},"source_id":{"type":"string","minLength":1},"evidence":{"$ref":"#/$defs/evidence"},"topics":{"type":"array","items":{"type":"string","minLength":1},"uniqueItems":true}}},"relationship":{"type":"object","required":["id","source_entity_id","target_entity_id","kind","source_id","claim_id","evidence","topics"],"additionalProperties":false,"properties":{"id":{"type":"string","minLength":1},"source_entity_id":{"type":"string","minLength":1},"target_entity_id":{"type":"string","minLength":1},"kind":{"type":"string","minLength":1},"source_id":{"type":"string","minLength":1},"claim_id":{"type":"string","minLength":1},"evidence":{"$ref":"#/$defs/evidence"},"topics":{"type":"array","items":{"type":"string","minLength":1},"uniqueItems":true}}}}}
