{
  "claims": [
    {
      "evidence": {
        "document_id": "doc-hmt-crypto-future-regime-2023",
        "quote": "The consultation set out proposals for a future cryptoasset regulatory regime.",
        "section": "line:2"
      },
      "id": "claim-crypto-1",
      "object": "Cryptoasset regulatory regime",
      "predicate": "consulted_on",
      "source_id": "hmt-crypto-future-regime-2023",
      "status": "consultation",
      "status_as_of": "2023-02-01",
      "subject": "HM Treasury",
      "topics": [
        "cryptoasset regulation"
      ]
    },
    {
      "evidence": {
        "document_id": "doc-hmt-dss-2023",
        "quote": "Consultation on a Digital Securities Sandbox.",
        "section": "line:2"
      },
      "id": "claim-dss-1",
      "object": "Digital Securities Sandbox",
      "predicate": "consulted_on",
      "source_id": "hmt-dss-2023",
      "status": "consultation",
      "status_as_of": "2023-07-11",
      "subject": "HM Treasury",
      "topics": [
        "Digital Securities Sandbox"
      ]
    },
    {
      "evidence": {
        "document_id": "doc-hmt-future-financial-services-2022",
        "quote": "The reforms proposed a financial market infrastructure sandbox.",
        "section": "line:2"
      },
      "id": "claim-edinburgh-1",
      "object": "DSS",
      "predicate": "proposed",
      "source_id": "hmt-future-financial-services-2022",
      "status": "proposal",
      "status_as_of": "2022-12-09",
      "subject": "HMT",
      "topics": [
        "Digital Securities Sandbox"
      ]
    },
    {
      "evidence": {
        "document_id": "doc-hmt-stablecoins-2020",
        "quote": "The consultation considered the regulatory approach to stable tokens.",
        "section": "line:2"
      },
      "id": "claim-stablecoin-1",
      "object": "Stablecoin regulation",
      "predicate": "consulted_on",
      "source_id": "hmt-stablecoins-2020",
      "status": "consultation",
      "status_as_of": "2021-01-07",
      "subject": "HM Treasury",
      "topics": [
        "stablecoins"
      ]
    }
  ],
  "documents": [
    {
      "id": "doc-hmt-crypto-future-regime-2023",
      "published_on": "2023-02-01",
      "retrieved_from": "fixture://hmt-crypto-future-regime-2023.json",
      "source_id": "hmt-crypto-future-regime-2023",
      "synthetic": true,
      "text": "Future regime\nPOLICYGRAPH_CLAIM: {\"id\":\"claim-crypto-1\",\"subject\":\"HM Treasury\",\"predicate\":\"consulted_on\",\"object\":\"Cryptoasset regulatory regime\",\"status\":\"consultation\",\"quote\":\"The consultation set out proposals for a future cryptoasset regulatory regime.\"}",
      "title": "Future financial services regulatory regime for cryptoassets"
    },
    {
      "id": "doc-hmt-dss-2023",
      "published_on": "2023-07-11",
      "retrieved_from": "fixture://hmt-dss-2023.json",
      "source_id": "hmt-dss-2023",
      "synthetic": true,
      "text": "Sandbox proposal\nPOLICYGRAPH_CLAIM: {\"id\":\"claim-dss-1\",\"subject\":\"HM Treasury\",\"predicate\":\"consulted_on\",\"object\":\"Digital Securities Sandbox\",\"status\":\"consultation\",\"quote\":\"Consultation on a Digital Securities Sandbox.\"}",
      "title": "Digital Securities Sandbox"
    },
    {
      "id": "doc-hmt-future-financial-services-2022",
      "published_on": "2022-12-09",
      "retrieved_from": "fixture://hmt-future-financial-services-2022.json",
      "source_id": "hmt-future-financial-services-2022",
      "synthetic": true,
      "text": "Digital markets\nPOLICYGRAPH_CLAIM: {\"id\":\"claim-edinburgh-1\",\"subject\":\"HMT\",\"predicate\":\"proposed\",\"object\":\"DSS\",\"status\":\"proposal\",\"quote\":\"The reforms proposed a financial market infrastructure sandbox.\"}",
      "title": "Financial Services: The Edinburgh Reforms"
    },
    {
      "id": "doc-hmt-stablecoins-2020",
      "published_on": "2021-01-07",
      "retrieved_from": "fixture://hmt-stablecoins-2020.json",
      "source_id": "hmt-stablecoins-2020",
      "synthetic": true,
      "text": "Stable tokens\nPOLICYGRAPH_CLAIM: {\"id\":\"claim-stablecoin-1\",\"subject\":\"HM Treasury\",\"predicate\":\"consulted_on\",\"object\":\"Stablecoin regulation\",\"status\":\"consultation\",\"quote\":\"The consultation considered the regulatory approach to stable tokens.\"}",
      "title": "UK regulatory approach to cryptoassets and stablecoins"
    }
  ],
  "entities": [
    {
      "aliases": [],
      "id": "cryptoasset-regulatory-regime",
      "kind": "policy",
      "name": "Cryptoasset regulatory regime"
    },
    {
      "aliases": [],
      "id": "digital-securities-sandbox",
      "kind": "policy",
      "name": "Digital Securities Sandbox"
    },
    {
      "aliases": [],
      "id": "hm-treasury",
      "kind": "organisation",
      "name": "HM Treasury"
    },
    {
      "aliases": [],
      "id": "stablecoin-regulation",
      "kind": "policy",
      "name": "Stablecoin regulation"
    }
  ],
  "events": [
    {
      "date": null,
      "evidence": {
        "document_id": "doc-hmt-crypto-future-regime-2023",
        "quote": "The consultation set out proposals for a future cryptoasset regulatory regime.",
        "section": "line:2"
      },
      "id": "event-claim-crypto-1",
      "source_id": "hmt-crypto-future-regime-2023",
      "status": "consultation",
      "status_as_of": "2023-02-01",
      "title": "HM Treasury consulted_on Cryptoasset regulatory regime",
      "topics": [
        "cryptoasset regulation"
      ]
    },
    {
      "date": null,
      "evidence": {
        "document_id": "doc-hmt-dss-2023",
        "quote": "Consultation on a Digital Securities Sandbox.",
        "section": "line:2"
      },
      "id": "event-claim-dss-1",
      "source_id": "hmt-dss-2023",
      "status": "consultation",
      "status_as_of": "2023-07-11",
      "title": "HM Treasury consulted_on Digital Securities Sandbox",
      "topics": [
        "Digital Securities Sandbox"
      ]
    },
    {
      "date": null,
      "evidence": {
        "document_id": "doc-hmt-future-financial-services-2022",
        "quote": "The reforms proposed a financial market infrastructure sandbox.",
        "section": "line:2"
      },
      "id": "event-claim-edinburgh-1",
      "source_id": "hmt-future-financial-services-2022",
      "status": "proposal",
      "status_as_of": "2022-12-09",
      "title": "HM Treasury proposed Digital Securities Sandbox",
      "topics": [
        "Digital Securities Sandbox"
      ]
    },
    {
      "date": null,
      "evidence": {
        "document_id": "doc-hmt-stablecoins-2020",
        "quote": "The consultation considered the regulatory approach to stable tokens.",
        "section": "line:2"
      },
      "id": "event-claim-stablecoin-1",
      "source_id": "hmt-stablecoins-2020",
      "status": "consultation",
      "status_as_of": "2021-01-07",
      "title": "HM Treasury consulted_on Stablecoin regulation",
      "topics": [
        "stablecoins"
      ]
    }
  ],
  "fixture_set_sha256": "906362cea16a9135b643d09a65f46bfaa7bdc19a94d3b3f03dd49d30c8beffd8",
  "generator_version": "policygraph-0.2.0",
  "relationships": [
    {
      "claim_id": "claim-crypto-1",
      "evidence": {
        "document_id": "doc-hmt-crypto-future-regime-2023",
        "quote": "The consultation set out proposals for a future cryptoasset regulatory regime.",
        "section": "line:2"
      },
      "id": "rel-claim-crypto-1",
      "kind": "consulted_on",
      "source_entity_id": "hm-treasury",
      "source_id": "hmt-crypto-future-regime-2023",
      "target_entity_id": "cryptoasset-regulatory-regime",
      "topics": [
        "cryptoasset regulation"
      ]
    },
    {
      "claim_id": "claim-dss-1",
      "evidence": {
        "document_id": "doc-hmt-dss-2023",
        "quote": "Consultation on a Digital Securities Sandbox.",
        "section": "line:2"
      },
      "id": "rel-claim-dss-1",
      "kind": "consulted_on",
      "source_entity_id": "hm-treasury",
      "source_id": "hmt-dss-2023",
      "target_entity_id": "digital-securities-sandbox",
      "topics": [
        "Digital Securities Sandbox"
      ]
    },
    {
      "claim_id": "claim-edinburgh-1",
      "evidence": {
        "document_id": "doc-hmt-future-financial-services-2022",
        "quote": "The reforms proposed a financial market infrastructure sandbox.",
        "section": "line:2"
      },
      "id": "rel-claim-edinburgh-1",
      "kind": "proposed",
      "source_entity_id": "hm-treasury",
      "source_id": "hmt-future-financial-services-2022",
      "target_entity_id": "digital-securities-sandbox",
      "topics": [
        "Digital Securities Sandbox"
      ]
    },
    {
      "claim_id": "claim-stablecoin-1",
      "evidence": {
        "document_id": "doc-hmt-stablecoins-2020",
        "quote": "The consultation considered the regulatory approach to stable tokens.",
        "section": "line:2"
      },
      "id": "rel-claim-stablecoin-1",
      "kind": "consulted_on",
      "source_entity_id": "hm-treasury",
      "source_id": "hmt-stablecoins-2020",
      "target_entity_id": "stablecoin-regulation",
      "topics": [
        "stablecoins"
      ]
    }
  ],
  "schema_version": "1.0",
  "sources": [
    {
      "content_path": "/government/consultations/future-financial-services-regulatory-regime-for-cryptoassets",
      "id": "hmt-crypto-future-regime-2023",
      "kind": "govuk_content",
      "published_on": "2023-02-01",
      "publisher": "HM Treasury",
      "status": "consultation",
      "status_as_of": "2023-02-01",
      "title": "Future financial services regulatory regime for cryptoassets",
      "topics": [
        "cryptoasset regulation"
      ],
      "url": "https://www.gov.uk/government/consultations/future-financial-services-regulatory-regime-for-cryptoassets"
    },
    {
      "content_path": "/government/consultations/digital-securities-sandbox",
      "id": "hmt-dss-2023",